<?xml version="1.0" encoding="UTF-8"?>

<schema xmlns="http://www.w3.org/2001/XMLSchema"
        targetNamespace="http://www.epam.com/menu"
        xmlns:tns="http://www.epam.com/menu">

    <element name="dishes">
        <complexType>
            <sequence>
                <element name="dish" type="tns:Dish" minOccurs="1" maxOccurs="unbounded"/>
            </sequence>
        </complexType>
    </element>

    <complexType name="Dish">
        <all>
            <element name="type" type="tns:DishEnum"/>
            <element name="photo" type="string"/>
            <element name="name" type="string"/>
            <element name="description" type="string" minOccurs="0"/>
            <element name="portion" type="tns:Portion"/>
            <element name="price" type="tns:Price">
                <unique name="uniquename">
                    <selector xpath="option"/>
                    <field xpath="@name"/>
                </unique>
            </element>
        </all>
    </complexType>

    <simpleType name="Portion">
        <restriction base="string">
            <pattern value="((\d+)(\/\d+)*)|([1-9][0-9]* шт\.)"/>
        </restriction>
    </simpleType>

    <complexType name="Price">
        <choice>
            <element name="value" type="tns:OneFromOther"/>
            <element name="option" type="tns:ChoisePosition" minOccurs="1" maxOccurs="unbounded"/>
        </choice>
    </complexType>

    <complexType name="ChoisePosition">
        <simpleContent>
            <extension base="tns:OneFromOther">
                <attribute name="name" type="string" use="required">
                </attribute>
            </extension>
        </simpleContent>
    </complexType>

    <simpleType name="OneFromOther">
        <restriction base="double">
            <minInclusive value="0"/>
        </restriction>
    </simpleType>

    <simpleType name="DishEnum">
        <restriction base="string">
            <enumeration value="Холодные закуски"/>
            <enumeration value="Горячие закуски"/>
            <enumeration value="Завтрак"/>
            <enumeration value="Салаты"/>
            <enumeration value="Супы"/>
            <enumeration value="Рыбные блюда"/>
            <enumeration value="Мясные блюда"/>
            <enumeration value="Гарниры"/>
            <enumeration value="Блюда на мангале"/>
            <enumeration value="От шеф-повара"/>
            <enumeration value="Приложение"/>
            <enumeration value="Десерт"/>
        </restriction>

    </simpleType>

</schema>